{
  "schema_version": "1.0",
  "test_id": "WIN-06",
  "run_id": "run_win_acc_2026-10-22_win-06",
  "recorded_at": "2026-10-22T04:25:10Z",
  "code_commit": "2d654d9199d4959a7492f4e519158a8255dc0f29",
  "binary_sha256": "c7024489970867fdfc43f3ad59a1284ac3f44d2b72386dae3be11b0a75cfa08c",
  "device_id": "dev_win11_x64_primary",
  "os": {
    "platform": "windows",
    "name": "Windows 11 Enterprise",
    "build": "10.0.26200",
    "architecture": "x64"
  },
  "filesystem": {
    "type": "NTFS",
    "volume_id": null
  },
  "permission_context": {
    "elevated": null,
    "signing_identity": null,
    "grants": [
      "doctor permissions.bypass_privileges: ordinary-permission context, no ACL-bypass privilege enabled"
    ]
  },
  "scope_digest": null,
  "fixture_manifest_sha256": "1cc33d71c8c34b78225dcc2b53f32f7c8d3dc999e6de9d17985d6bfc2417bb24",
  "backend": null,
  "config": {
    "round": "windows-acceptance-2026-10-22",
    "binary": "desktop debug build",
    "cli_sha256": "0f104e35a0e96527a7121c56d68322c33d509f54cecaa17aeffc1340153bdb15",
    "desktop_sha256": "c7024489970867fdfc43f3ad59a1284ac3f44d2b72386dae3be11b0a75cfa08c",
    "store": "isolated CM_STORE_DIR under .research/windows-acceptance-2026-10-22/store",
    "raw_evidence": [
      "ui-11-search-chinese-result.txt",
      "ui-12-search-empty-result.txt",
      "ui-13-search-cleared.txt",
      "cli-10-name-filter.json",
      "cli-11-empty-filter.json"
    ],
    "case_source": "docs/acceptance/windows-2026-10-22-cases.md",
    "report": "docs/acceptance/windows-2026-10-22-report.md"
  },
  "command": [],
  "seed": null,
  "expected": "命中正确；不存在时明确为空；清空后原条目回来，非错误或丢失扫描",
  "actual": "中文过滤命中 1 项；不存在的词明确为 0 项；清空后恢复 6 个当前层条目。",
  "terminal_state": "observed_in_native_window",
  "exit_code": null,
  "measurements": {
    "desktop": {
      "chinese_matches": 1,
      "absent_matches": 0,
      "rows_after_clear": 6
    },
    "cli": {
      "chinese_filter_items": 1,
      "empty_filter_items": 0
    }
  },
  "observer": "agent (Windows acceptance 2026-10-22: one-off runner acceptance_cli.py/summarize.py for CLI records; native Tauri window driven and read through the computer-use accessibility tree for desktop checks)",
  "limitations": [
    "Redacted transcription. Raw stdout/stderr, native-window accessibility text and screenshots stay local in .research/acceptance-raw/2026-10-22/ (gitignored: they contain the user name, the installed-software list and the live process list); file names are listed in config.raw_evidence.",
    "Debug builds of main@2d654d9 (CLI and Tauri desktop rebuilt for this run; no product code changed).",
    "Token elevation was not measured independently (the desktop maintenance page reported an elevated context); ordinary-user and UAC acceptance cannot be inferred from this run.",
    "A pass covers only the checkpoints this case lists in docs/acceptance/windows-2026-10-22-cases.md, not the module or a release gate."
  ],
  "status": "passed"
}
