{
  "schema_version": "1.0",
  "test_id": "CAT-03",
  "run_id": "run_win_catalog_google_chrome_http_cache",
  "recorded_at": "2026-10-15T07:32:25Z",
  "code_commit": "ddeae2f11fba1ac4ac5cc81178d98fb7625a1ae0",
  "binary_sha256": "5ce2d8537f707ac4cc11233de03aa726a161852ee535f53370786e55ddd31d94",
  "device_id": "dev_win11_x64_primary",
  "os": {
    "platform": "windows",
    "name": "Windows 11 Enterprise",
    "build": "10.0.26200",
    "architecture": "x64"
  },
  "filesystem": {
    "type": "NTFS",
    "volume_id": null
  },
  "permission_context": {
    "elevated": true,
    "signing_identity": null,
    "grants": [
      "SeBackupPrivilege/SeRestorePrivilege disabled by cleanmanager"
    ]
  },
  "scope_digest": null,
  "fixture_manifest_sha256": null,
  "backend": "win.directory",
  "config": {},
  "command": [
    "cleanmanager",
    "analyze",
    "--preview-rule",
    "rules/windows/google.chrome.http-cache.json"
  ],
  "seed": null,
  "expected": "Google Chrome 155.0.8059.41: a headless throwaway profile creates Default\\Cache\\Cache_Data; the preview matches only that directory (risk medium); after removal it is recreated and the page still renders",
  "actual": "created=True candidates=1 matched=1 risk=medium other_matches=0 regenerated_after_removal=True page_rendered=True",
  "terminal_state": "completed",
  "exit_code": 0,
  "measurements": {
    "app_version": "155.0.8059.41",
    "candidate_count": 1,
    "matched_logical_bytes": "5050736"
  },
  "observer": "tools/validate_rules_windows.py",
  "limitations": [
    "Working tree may contain uncommitted changes; code_commit is the base commit.",
    "Throwaway --user-data-dir and a 127.0.0.1 test server; the user's real profiles were not scanned or modified.",
    "The running-browser skip is a live probe (owner_process), covered by run_win_catalog_probe_e2e for another rule."
  ],
  "status": "passed"
}
