{
  "schema_version": "1.0",
  "test_id": "MNT-06",
  "run_id": "run_win_maint_diagnosis",
  "recorded_at": "2026-10-15T09:28:30Z",
  "code_commit": "791b6240796381227f9f40231e72c4fbd657c1a6",
  "binary_sha256": "96afd2536b3404e6768be1b2f3c93e0aa3fd81b78d42ef041234fdd4d004186f",
  "device_id": "dev_win11_x64_primary",
  "os": {
    "platform": "windows",
    "name": "Windows 11 Enterprise",
    "build": "10.0.26200",
    "architecture": "x64"
  },
  "filesystem": {
    "type": "NTFS",
    "volume_id": null
  },
  "permission_context": {
    "elevated": true,
    "signing_identity": null,
    "grants": [
      "SeBackupPrivilege/SeRestorePrivilege disabled by cleanmanager"
    ]
  },
  "scope_digest": null,
  "fixture_manifest_sha256": null,
  "backend": "win.maintenance",
  "config": {},
  "command": [
    "cleanmanager",
    "optimize",
    "diagnose",
    "--window",
    "3"
  ],
  "seed": null,
  "expected": "Read-only diagnosis lists findings and next steps and ends no process",
  "actual": "read_only=True findings=[('many_startup_items', 'startup')] top=['System', 'unsecapp.exe', 'Taskmgr.exe', 'claude.exe', 'claude.exe']",
  "terminal_state": "completed",
  "exit_code": 0,
  "measurements": {
    "memory_load_percent": 48.0,
    "commit_used_percent": 86.7
  },
  "observer": "agent (parity 14.2 evidence)",
  "limitations": [
    "Working tree contains uncommitted changes of several concurrent tasks; code_commit is the base commit.",
    "Debug build of cleanmanager.exe; the shell was elevated, so administrator tasks ran in-process (elevation=already_elevated), not through the UAC worker.",
    "The interactive-review receipt was written to the store directly (the agent has no TTY), exactly as the CLI integration tests do."
  ],
  "status": "passed"
}
