{
  "schema_version": "1.0",
  "test_id": "CAT-07",
  "run_id": "run_win_catalog_windows_downloads_incomplete",
  "recorded_at": "2026-10-15T07:32:32Z",
  "code_commit": "ddeae2f11fba1ac4ac5cc81178d98fb7625a1ae0",
  "binary_sha256": "5ce2d8537f707ac4cc11233de03aa726a161852ee535f53370786e55ddd31d94",
  "device_id": "dev_win11_x64_primary",
  "os": {
    "platform": "windows",
    "name": "Windows 11 Enterprise",
    "build": "10.0.26200",
    "architecture": "x64"
  },
  "filesystem": {
    "type": "NTFS",
    "volume_id": null
  },
  "permission_context": {
    "elevated": true,
    "signing_identity": null,
    "grants": [
      "SeBackupPrivilege/SeRestorePrivilege disabled by cleanmanager"
    ]
  },
  "scope_digest": null,
  "fixture_manifest_sha256": null,
  "backend": "win.directory",
  "config": {},
  "command": [
    "cleanmanager",
    "analyze",
    "--preview-rule",
    "rules/windows/windows.downloads.incomplete.json"
  ],
  "seed": null,
  "expected": "Only unfinished-download files directly in Downloads and untouched for 7 days are review-only candidates",
  "actual": "candidates=['setup.exe.crdownload'] real_download_markers_present=0",
  "terminal_state": "completed",
  "exit_code": 0,
  "measurements": {
    "os_version": "10.0.26200",
    "candidate_count": 1
  },
  "observer": "tools/validate_rules_windows.py",
  "limitations": [
    "Working tree may contain uncommitted changes; code_commit is the base commit.",
    "Controlled fixture through the real resolver (CM_RESOLVE_DOWNLOADS); the real Downloads folder was only counted, not scanned."
  ],
  "status": "passed"
}
