{
  "schema_version": "1.0",
  "test_id": "CAT-07",
  "run_id": "run_win_catalog_bytedance_feishu_logs",
  "recorded_at": "2026-10-15T10:25:00Z",
  "code_commit": "4ecf4f123ff55532daf53c3e3905c9d13f039d14",
  "binary_sha256": "960e95aa5f8159b4ac60b9c318b6ce3c5d5fc8a840df6c1e9e1f56f641ea023e",
  "device_id": "dev_win11_x64_primary",
  "os": {
    "platform": "windows",
    "name": "Windows 11 Enterprise",
    "build": "10.0.26200",
    "architecture": "x64"
  },
  "filesystem": {
    "type": "NTFS",
    "volume_id": null
  },
  "permission_context": {
    "elevated": true,
    "signing_identity": null,
    "grants": [
      "SeBackupPrivilege/SeRestorePrivilege disabled by cleanmanager"
    ]
  },
  "scope_digest": null,
  "fixture_manifest_sha256": null,
  "backend": "win.directory",
  "config": {},
  "command": [
    "cleanmanager",
    "analyze",
    "--preview-rule",
    "rules/windows/bytedance.feishu.logs.json"
  ],
  "seed": null,
  "expected": "Feishu 7.75.18: the rule matches exactly the oracle set in the real location (read-only scan) (min age 7 days, modified time), every row review-only; in a lookalike fixture through the real resolver only ['apollo-0-2026-01-01.alaudalog', 'netlog\\\\netmain-0-2026-01-01.alaudalog'] match",
  "actual": "real: candidates=0 expected_by_oracle=0 match=True risks=[]; fixture: candidates=['apollo-0-2026-01-01.alaudalog', 'netlog\\\\netmain-0-2026-01-01.alaudalog'] expected=['apollo-0-2026-01-01.alaudalog', 'netlog\\\\netmain-0-2026-01-01.alaudalog'] oracle_agrees=True (real logs are all younger than 7 days on this device)",
  "terminal_state": "completed",
  "exit_code": 0,
  "measurements": {
    "owner_version": "7.75.18",
    "real_candidates": [],
    "real_expected": [],
    "real_matched_logical_bytes": "0",
    "fixture_candidates": [
      "apollo-0-2026-01-01.alaudalog",
      "netlog\\netmain-0-2026-01-01.alaudalog"
    ],
    "fixture_expected": [
      "apollo-0-2026-01-01.alaudalog",
      "netlog\\netmain-0-2026-01-01.alaudalog"
    ]
  },
  "observer": "tools/validate_catalog_windows_wave2.py",
  "limitations": [
    "Working tree may contain uncommitted changes; code_commit is the base commit.",
    "Real location scanned read-only into a scratch store; nothing was removed, so regeneration was not exercised and the rule stays review_only.",
    "Fixture reached through CM_RESOLVE_* overrides; the resolver_override issue marks those results as fixture-based."
  ],
  "status": "passed"
}
